{"$id":"https://offdata.local/schemas/pcfa04-product-scope-implementation-addendum.schema.json","$schema":"https://json-schema.org/draft/2020-12/schema","additionalProperties":false,"properties":{"addendum_id":{"const":"PRODUCT-SCOPE-IMPLEMENTATION-ADDENDUM"},"boundaries":{"additionalProperties":{"type":"boolean"},"required":["founder_accountability_preserved","codex_start_authorized","phase0_implementation_authorized","phase0_merge_authorized","phase1_authorized","merge_authorized","runtime_activation_authorized","hermes_activation_authorized","real_client_data_enabled","external_actions_authorized","paid_services_authorized","oauth_authorized","production_deployment_authorized","autonomous_merge_authorized"],"type":"object"},"generated_from":{"const":"configs/pcfa04-product-scope-implementation-addendum.yaml"},"implementation_rules":{"items":{"type":"string"},"minItems":8,"type":"array","uniqueItems":true},"owner":{"const":"Founder"},"pcfa07_reconciliation_contract":{"additionalProperties":{"const":true},"minProperties":6,"type":"object"},"phase_ownership_summary":{"additionalProperties":{"type":"string"},"minProperties":13,"type":"object"},"product_areas":{"items":{"additionalProperties":false,"properties":{"area_id":{"pattern":"^PSA-[A-Z0-9-]+$","type":"string"},"integration_points":{"items":{"pattern":"^P(?:[1-9]|1[0-2])\\.[1-9][0-9]*$","type":"string"},"minItems":1,"type":"array","uniqueItems":true},"owning_imp_phases":{"items":{"pattern":"^IMP-P(?:[1-9]|1[0-2])$","type":"string"},"minItems":1,"type":"array","uniqueItems":true},"planned_test_family":{"pattern":"^PCFA04-[A-Z0-9-]+$","type":"string"},"requirement_ids":{"items":{"pattern":"^(?:PS-[A-Z0-9-]+|CQ-[A-Z0-9-]+)$","type":"string"},"minItems":1,"type":"array","uniqueItems":true},"status":{"const":"planned_not_implemented"},"title":{"minLength":1,"type":"string"}},"required":["area_id","title","requirement_ids","owning_imp_phases","integration_points","planned_test_family","status"],"type":"object"},"minItems":14,"type":"array","uniqueItems":true},"repository":{"const":"rayrayxing/offdata-os"},"requirements":{"items":{"additionalProperties":false,"properties":{"acceptance":{"minLength":1,"type":"string"},"id":{"pattern":"^(?:PS-[A-Z0-9-]+|CQ-[A-Z0-9-]+)$","type":"string"},"statement":{"minLength":1,"type":"string"},"status":{"const":"planned_not_implemented"}},"required":["id","statement","acceptance","status"],"type":"object"},"minItems":29,"type":"array"},"schema_version":{"const":"1.0.0"},"scope_boundary":{"additionalProperties":false,"properties":{"canonical_state_mutation_implemented":{"const":false},"codex_start_authorized":{"const":false},"imp_phase_scope_widened":{"const":false},"pcfa05_mvcl_contract_required":{"const":true},"pcfa07_registry_reconciliation_required":{"const":true},"product_runtime_implemented":{"const":false},"specification_only":{"const":true}},"required":["specification_only","product_runtime_implemented","canonical_state_mutation_implemented","imp_phase_scope_widened","codex_start_authorized","pcfa05_mvcl_contract_required","pcfa07_registry_reconciliation_required"],"type":"object"},"status":{"const":"repository_specification_complete_planned_not_implemented"},"title":{"const":"Product-scope implementation addendum"},"work_package_id":{"const":"PCFA-04"}},"required":["schema_version","work_package_id","addendum_id","title","repository","status","owner","generated_from","scope_boundary","implementation_rules","product_areas","requirements","phase_ownership_summary","pcfa07_reconciliation_contract","boundaries"],"title":"offdata PCFA-04 product-scope implementation addendum","type":"object"}
