{"addendum_id":"PRODUCT-SCOPE-IMPLEMENTATION-ADDENDUM","boundaries":{"autonomous_merge_authorized":false,"codex_start_authorized":false,"external_actions_authorized":false,"founder_accountability_preserved":true,"hermes_activation_authorized":false,"merge_authorized":false,"oauth_authorized":false,"paid_services_authorized":false,"phase0_implementation_authorized":false,"phase0_merge_authorized":false,"phase1_authorized":false,"production_deployment_authorized":false,"real_client_data_enabled":false,"runtime_activation_authorized":false},"generated_from":"configs/pcfa04-product-scope-implementation-addendum.yaml","implementation_rules":["one_canonical_engagement_state","engagement_workspace_is_view_over_canonical_state","quality_console_is_view_over_canonical_state","implementation_benefits_trace_to_approved_recommendations","material_claims_and_numbers_remain_traceable","founder_accountability_preserved","no_uncontrolled_self_modification","no_requirement_marked_implemented_before_codex_evidence"],"owner":"Founder","pcfa07_reconciliation_contract":{"every_requirement_must_receive_blocking_phase_gate":true,"every_requirement_must_receive_dependency_mapping":true,"every_requirement_must_receive_evidence_type":true,"every_requirement_must_receive_exact_task_binding":true,"every_requirement_must_receive_planned_test_id":true,"status_must_remain_planned_not_implemented_until_codex_evidence":true},"phase_ownership_summary":{"IMP-P0":"No new product-runtime scope; only foundation must preserve extension points and fail-closed boundaries.","IMP-P1":"Broader source matrix, native provenance locators, canonical-library accounting and asset-rights provenance foundation.","IMP-P10":"No new standalone method state; Radar feeds the governed source/method registry without auto-promotion.","IMP-P11":"Mature QA/security release controls and material asset-rights enforcement.","IMP-P12":"Founder-attention metrics, golden/CQ/round-trip/variant/library completeness acceptance and cross-engagement validation.","IMP-P2":"Mandate workbench shell, Engagement Workspace, QA Console shell, Implementation/Benefits records, house-style profile and review records.","IMP-P3":"Review/recycle workflow, implementation/benefit lifecycle and governed interaction states.","IMP-P4":"Mandate/context enhancement and Consulting Craft evaluation harnesses.","IMP-P5":"Source-locator evidence adapters, mandate research support and evidence traceability.","IMP-P6":"Existing quantitative reproducibility remains the numeric foundation consumed by new workspaces and QA.","IMP-P7":"Consulting Craft quality, output variants, golden outputs, style application, rights checks and Office round-trip reconciliation.","IMP-P8":"No new standalone surface; CRM conversion must populate the same mandate and engagement model.","IMP-P9":"No new standalone state; origination must feed the same CRM/opportunity/mandate path."},"product_areas":[{"area_id":"PSA-MANDATE","integration_points":["P2.2","P2.4","P4.1","P5.1"],"owning_imp_phases":["IMP-P2","IMP-P4","IMP-P5"],"planned_test_family":"PCFA04-MANDATE","requirement_ids":["PS-MANDATE-001"],"status":"planned_not_implemented","title":"Mandate Intake Workbench"},{"area_id":"PSA-ENGAGEMENT-WORKSPACE","integration_points":["P2.4","P3.4","P4.1","P5.3","P6.4","P7.1"],"owning_imp_phases":["IMP-P2","IMP-P3","IMP-P4","IMP-P5","IMP-P6","IMP-P7"],"planned_test_family":"PCFA04-ENGAGEMENT-WORKSPACE","requirement_ids":["PS-ENGAGEMENT-001"],"status":"planned_not_implemented","title":"Explicit Engagement Workspace"},{"area_id":"PSA-QUALITY-CONSOLE","integration_points":["P2.3","P3.4","P4.4","P5.4","P6.4","P7.5","P11.3"],"owning_imp_phases":["IMP-P2","IMP-P3","IMP-P4","IMP-P5","IMP-P6","IMP-P7","IMP-P11"],"planned_test_family":"PCFA04-QA-CONSOLE","requirement_ids":["PS-QA-001"],"status":"planned_not_implemented","title":"Quality and Assurance Console"},{"area_id":"PSA-IMPLEMENTATION-BENEFITS","integration_points":["P2.2","P3.2","P3.4","P12.3"],"owning_imp_phases":["IMP-P2","IMP-P3","IMP-P12"],"planned_test_family":"PCFA04-IMPLEMENTATION-BENEFITS","requirement_ids":["PS-IMPLEMENTATION-001"],"status":"planned_not_implemented","title":"Implementation and Benefits Workspace"},{"area_id":"PSA-INGESTION","integration_points":["P1.1","P1.2","P1.5","P5.2","P5.3"],"owning_imp_phases":["IMP-P1","IMP-P5"],"planned_test_family":"PCFA04-INGESTION","requirement_ids":["PS-INGEST-001","PS-LOCATOR-001"],"status":"planned_not_implemented","title":"Broader ingestion source matrix and native locators"},{"area_id":"PSA-LIBRARY-COMPLETENESS","integration_points":["P1.3","P1.4","P1.5","P12.3"],"owning_imp_phases":["IMP-P1","IMP-P12"],"planned_test_family":"PCFA04-LIBRARY-COMPLETENESS","requirement_ids":["PS-LIBRARY-001"],"status":"planned_not_implemented","title":"Canonical library completeness gate"},{"area_id":"PSA-CONSULTING-CRAFT","integration_points":["P4.4","P7.1","P7.5","P12.3"],"owning_imp_phases":["IMP-P4","IMP-P7","IMP-P12"],"planned_test_family":"PCFA04-CONSULTING-CRAFT","requirement_ids":["CQ-DECISION","CQ-ANSWER","CQ-TITLE","CQ-STORY","CQ-MECE","CQ-ALT","CQ-UNCERT","CQ-DENSITY","CQ-VISUAL","CQ-HIER","CQ-REDUND","CQ-ACTION","CQ-RISK","CQ-AUDIENCE","CQ-EXEC"],"status":"planned_not_implemented","title":"Consulting Craft quality family"},{"area_id":"PSA-GOLDEN-OUTPUTS","integration_points":["P7.5","P12.1","P12.2","P12.3"],"owning_imp_phases":["IMP-P7","IMP-P12"],"planned_test_family":"PCFA04-GOLDEN-OUTPUTS","requirement_ids":["PS-GOLDEN-001"],"status":"planned_not_implemented","title":"Broader golden output programme"},{"area_id":"PSA-OFFICE-ROUNDTRIP","integration_points":["P7.3","P7.5","P12.3"],"owning_imp_phases":["IMP-P7","IMP-P12"],"planned_test_family":"PCFA04-OFFICE-ROUNDTRIP","requirement_ids":["PS-ROUNDTRIP-001"],"status":"planned_not_implemented","title":"Office round-trip reconciliation"},{"area_id":"PSA-HOUSE-STYLE","integration_points":["P2.2","P7.1","P7.2","P7.3","P12.3"],"owning_imp_phases":["IMP-P2","IMP-P7","IMP-P12"],"planned_test_family":"PCFA04-HOUSE-STYLE","requirement_ids":["PS-STYLE-001"],"status":"planned_not_implemented","title":"Founder and house style profile"},{"area_id":"PSA-ASSET-RIGHTS","integration_points":["P1.1","P7.2","P7.3","P7.4","P7.5","P11.2"],"owning_imp_phases":["IMP-P1","IMP-P7","IMP-P11"],"planned_test_family":"PCFA04-ASSET-RIGHTS","requirement_ids":["PS-ASSET-RIGHTS-001"],"status":"planned_not_implemented","title":"Deliverable asset-rights provenance"},{"area_id":"PSA-FOUNDER-ATTENTION","integration_points":["P2.3","P3.3","P12.3"],"owning_imp_phases":["IMP-P2","IMP-P3","IMP-P12"],"planned_test_family":"PCFA04-FOUNDER-ATTENTION","requirement_ids":["PS-FOUNDER-ATTENTION-001"],"status":"planned_not_implemented","title":"Founder attention burden metrics"},{"area_id":"PSA-DELIVERABLE-VARIANTS","integration_points":["P7.1","P7.3","P7.5"],"owning_imp_phases":["IMP-P7"],"planned_test_family":"PCFA04-DELIVERABLE-VARIANTS","requirement_ids":["PS-DELIVERABLE-VARIANTS-001"],"status":"planned_not_implemented","title":"Explicit deliverable variants"},{"area_id":"PSA-REVIEW-WORKFLOW","integration_points":["P2.2","P2.3","P3.2","P3.4","P7.5"],"owning_imp_phases":["IMP-P2","IMP-P3","IMP-P7"],"planned_test_family":"PCFA04-REVIEW-WORKFLOW","requirement_ids":["PS-REVIEW-001"],"status":"planned_not_implemented","title":"Review and change-request workflow"}],"repository":"rayrayxing/offdata-os","requirements":[{"acceptance":"Mandate packet fields are traceable to source or labelled assumption and do not create a second engagement state.","id":"PS-MANDATE-001","statement":"Convert notes, transcripts, documents and CRM context into a governed mandate packet containing decision statement, owner/date, problem, scope, constraints, options, facts, assumptions, interpretations, gaps, evidence standard, hypotheses, methods, data requests and engagement plan, escalating only material gaps to the Founder.","status":"planned_not_implemented"},{"acceptance":"No workspace surface owns duplicate canonical state.","id":"PS-ENGAGEMENT-001","statement":"Provide one Engagement Workspace with Overview, Mandate, Decisions, Hypotheses, Evidence, Methods, Analysis, Recommendations, Story, Deliverables, Implementation, Benefits, Quality and Audit surfaces as views over canonical state.","status":"planned_not_implemented"},{"acceptance":"Material blocking defects cannot be hidden by presentation state or waived without governed disposition.","id":"PS-QA-001","statement":"Provide a Quality and Assurance Console showing defect, severity, materiality, affected record, creator, independent reviewer, rubric/test, block status, repair, disposition, waiver, rerun evidence and release impact.","status":"planned_not_implemented"},{"acceptance":"Benefits cannot exist without an approved recommendation and baseline linkage.","id":"PS-IMPLEMENTATION-001","statement":"Trace recommendation to initiative, milestone, dependency, owner, delivery, adoption, outcome, benefit and verification while distinguishing work completed, adoption, outcome and realised benefit.","status":"planned_not_implemented"},{"acceptance":"Original bytes/checksum are preserved and unsupported or malformed sources are quarantined rather than silently normalised.","id":"PS-INGEST-001","statement":"Support governed ingestion for Markdown/TXT, DOCX, digital PDF, PPTX, XLSX, CSV and HTML/web snapshots first, with scanned images/OCR, email packages, transcripts/audio-video derivatives and archives treated as later adapters.","status":"planned_not_implemented"},{"acceptance":"Material claims can resolve to source-native locations after ingestion and re-ingestion.","id":"PS-LOCATOR-001","statement":"Preserve native provenance locators for PDF page/region, DOCX section/paragraph/table, PPTX slide/shape, XLSX sheet/cell/range/formula, HTML URL/snapshot/DOM-text locator and transcript speaker/timestamp.","status":"planned_not_implemented"},{"acceptance":"No approved canonical source is silently unaccounted